subject_id,topic_id,exam_type,year,difficulty,question_text,passage,passage_id,question_image_url,image_alt_text,image_width,image_height,option_a,option_b,option_c,option_d,option_e,correct_answer,hint,solution,further_study_links
example-uuid-eng-001,example-uuid-reading-001,WAEC,2023,medium,"What is the main theme of the passage?","In the heart of Lagos, a young entrepreneur named Amina started a small tech company. Despite facing numerous challenges including limited funding and fierce competition, she persevered. Her innovative approach to solving local problems through technology caught the attention of investors. Within three years, her company grew from a team of three to over fifty employees, making a significant impact on the community.",PASSAGE_ENG_001,,,,,Perseverance and innovation,Competition in business,Technology advancement,Urban development,,A,Look for the central message throughout the passage,"The passage emphasizes Amina's perseverance despite challenges and her innovative approach, which are the key themes that drive the narrative.",https://example.com/reading-comprehension
example-uuid-eng-001,example-uuid-reading-001,WAEC,2023,easy,"How many employees did Amina's company have initially?",,,PASSAGE_ENG_001,,,,,One,Three,Five,Ten,,B,The passage mentions the starting team size,"The passage explicitly states 'her company grew from a team of three', indicating the initial number of employees.",https://example.com/reading-comprehension
example-uuid-eng-001,example-uuid-reading-001,WAEC,2023,hard,"What can be inferred about Amina's approach to business?",,,PASSAGE_ENG_001,,,,,She focused on international markets,She prioritized solving local problems,She avoided taking risks,She relied solely on government support,,B,Consider what made her successful,"The passage states 'Her innovative approach to solving local problems through technology' which indicates her business focus.",https://example.com/reading-comprehension
example-uuid-eng-001,example-uuid-reading-002,JAMB,2024,medium,"What is the author's tone in this passage?","The effects of climate change are becoming increasingly evident across Africa. Rising temperatures, unpredictable rainfall patterns, and extreme weather events are threatening agricultural productivity. Farmers who once relied on traditional planting seasons now face uncertainty. However, innovative solutions such as drought-resistant crops and modern irrigation systems offer hope for sustainable agriculture in the region.",PASSAGE_ENG_002,,,,,Optimistic,Pessimistic,Neutral,Alarmed,,A,Consider the overall message and conclusion,"While the passage acknowledges serious challenges, it ends with 'offer hope', indicating an optimistic tone about solutions.",https://example.com/tone-analysis
example-uuid-eng-001,example-uuid-reading-002,JAMB,2024,easy,"According to the passage, what threatens agricultural productivity?",,,PASSAGE_ENG_002,,,,,Lack of farmers,Climate change effects,Poor soil quality,Insufficient markets,,B,The answer is stated directly in the passage,"The passage explicitly mentions 'Rising temperatures, unpredictable rainfall patterns, and extreme weather events are threatening agricultural productivity.'",https://example.com/reading-comprehension